{
  "schemaVersion": "ofarm.evidencesufficiencycase.v0.1",
  "sufficiencyCaseId": "evidence-case:field-17:inspection-dossier-attestation:2026-04-10",
  "generatedAt": "2026-04-10T10:02:00Z",
  "caseClass": "DOCUMENT_ATTESTATION",
  "targetTwin": "COMPLIANCE",
  "anchorScopes": [
    {
      "scopeType": "FIELD",
      "scopeRef": "field:17"
    }
  ],
  "subject": {
    "subjectType": "DOSSIER_ASSEMBLY",
    "subjectRef": "dossier:field-17:organic-inspection:2026-04-10"
  },
  "governingPolicyRefs": [
    "evidence-policy:organic-inspection-dossier:v1",
    "attestation-policy:inspection-dossier-signoff:v1"
  ],
  "materializationBasisRef": "basis:field-17:compliance:2026-04-10T09:35:00Z",
  "materializationSnapshotRef": "snapshot:field-17:dossier-basis:2026-04-10T10:00:00Z",
  "claims": [
    {
      "claimId": "claim:inspection-dossier-integrity",
      "claimType": "OUTPUT_INTEGRITY_CLAIM",
      "claimRef": "dossier:field-17:organic-inspection:2026-04-10",
      "statement": "The inspection dossier is sufficiently grounded and may enter governed attestation/sign-off."
    }
  ],
  "arguments": [
    {
      "argumentId": "argument:dossier-grounding",
      "supportsClaimIds": [
        "claim:inspection-dossier-integrity"
      ],
      "policyRef": "evidence-policy:organic-inspection-dossier:v1",
      "ruleRef": "rule:inspection-dossier:grounding-and-basis-retention:v1",
      "conclusion": "SUPPORTED",
      "notes": "The dossier points to retained current-state basis and includes the required supporting inspection evidence bundle."
    }
  ],
  "evidenceBundles": [
    {
      "bundleId": "bundle:inspection-dossier:field-17",
      "bundleRef": "evidence-bundle:inspection-dossier:field-17:2026-04-10",
      "supportsArgumentIds": [
        "argument:dossier-grounding"
      ],
      "bundleStatus": "COMPLETE",
      "rawSourceRefs": [
        "evidence:field-17:inspection-checklist-scan:2026-04-10",
        "evidence:field-17:parcel-photo-set:2026-04-10"
      ],
      "normalizedInterpretationRefs": [
        "evidence-interpretation:field-17:inspection-findings:v1"
      ],
      "provenanceRefs": [
        "provenance:field-17:inspection-photos-to-dossier:2026-04-10",
        "provenance:field-17:basis-to-dossier-bind:2026-04-10"
      ],
      "chainOfCustodyStatus": "PRESERVED"
    }
  ],
  "reviewDecisionRefs": [
    "review:inspection-dossier:field-17:approved-for-attestation:2026-04-10"
  ],
  "attestationPlan": {
    "attestationRequired": true,
    "attestationActionFamily": "OUTPUT_ATTEST_DOCUMENT_ASSEMBLY",
    "portableEnvelopeMode": "NONE",
    "signatoryAuthorityRef": "authority-grant:certifier-signatory:field-17:2026",
    "notes": "Portable export envelopes remain optional; internal sign-off proceeds through governed document attestation."
  },
  "outcome": {
    "decision": "ALLOW",
    "rationale": "The dossier has retained basis grounding and a complete supporting bundle, so attestation may proceed under explicit signatory authority.",
    "attestationAllowed": true
  }
}
