{
  "schemaVersion": "ofarm.evidencesufficiencycase.v0.1",
  "sufficiencyCaseId": "evidence-case:field-17:organic-input-assertion:2026-04-10",
  "generatedAt": "2026-04-10T09:36:00Z",
  "caseClass": "COMPLIANCE_ASSERTION",
  "targetTwin": "COMPLIANCE",
  "anchorScopes": [
    {
      "scopeType": "FIELD",
      "scopeRef": "field:17"
    }
  ],
  "subject": {
    "subjectType": "ASSERTION_RECORD",
    "subjectRef": "assertion:field-17:organic-input-compliance:2026-season"
  },
  "governingPolicyRefs": [
    "evidence-policy:organic-field-compliance:v1"
  ],
  "materializationBasisRef": "basis:field-17:compliance:2026-04-10T09:35:00Z",
  "claims": [
    {
      "claimId": "claim:organic-input-compliance",
      "claimType": "COMPLIANCE_CLAIM",
      "claimRef": "assertion:field-17:organic-input-compliance:2026-season",
      "statement": "Field 17 organic-input compliance assertion has sufficient evidence for governed promotion."
    }
  ],
  "arguments": [
    {
      "argumentId": "argument:organic-input-support",
      "supportsClaimIds": [
        "claim:organic-input-compliance"
      ],
      "policyRef": "evidence-policy:organic-field-compliance:v1",
      "ruleRef": "rule:organic-field-compliance:input-ledger-support:v1",
      "conclusion": "SUPPORTED",
      "notes": "Operator declaration, input ledger, and parcel-linked inspection note together satisfy the minimum evidence posture."
    }
  ],
  "evidenceBundles": [
    {
      "bundleId": "bundle:field-17:organic-input-support",
      "bundleRef": "evidence-bundle:field-17:organic-input-support:2026-04-10",
      "supportsArgumentIds": [
        "argument:organic-input-support"
      ],
      "bundleStatus": "COMPLETE",
      "rawSourceRefs": [
        "evidence:field-17:input-ledger-scan:2026-04-09",
        "evidence:field-17:operator-declaration:2026-04-10"
      ],
      "normalizedInterpretationRefs": [
        "evidence-interpretation:field-17:input-ledger:no-prohibited-material:v1"
      ],
      "provenanceRefs": [
        "provenance:field-17:ledger-scan-to-parse:2026-04-09",
        "provenance:field-17:declaration-to-assertion-link:2026-04-10"
      ],
      "chainOfCustodyStatus": "PRESERVED"
    }
  ],
  "reviewDecisionRefs": [
    "review:field-17:organic-input-compliance:accepted:2026-04-10"
  ],
  "outcome": {
    "decision": "ALLOW",
    "rationale": "The governing evidence policy is satisfied by a complete bundle with raw source, normalized interpretation, and provenance. Promotion may proceed.",
    "attestationAllowed": false
  }
}
